  1   0.000000    127.0.0.1 -> 127.0.0.1    TCP 54 isis > 0 [<None>] Seq=1 Win=512 Len=0
  2   0.000015    127.0.0.1 -> 127.0.0.1    TCP 54 0 > isis [RST, ACK] Seq=1 Ack=1 Win=0 Len=0
  3   0.010060    127.0.0.1 -> 127.0.0.1    TCP 54 isis-bcast > 0 [<None>] Seq=1 Win=512 Len=0
  4   0.010071    127.0.0.1 -> 127.0.0.1    TCP 54 0 > isis-bcast [RST, ACK] Seq=1 Ack=1 Win=0 Len=0
  5   0.020110    127.0.0.1 -> 127.0.0.1    TCP 54 rimsl > 0 [<None>] Seq=1 Win=512 Len=0
  6   0.020131    127.0.0.1 -> 127.0.0.1    TCP 54 0 > rimsl [RST, ACK] Seq=1 Ack=1 Win=0 Len=0
  7   0.030182    127.0.0.1 -> 127.0.0.1    TCP 54 cdfunc > 0 [<None>] Seq=1 Win=512 Len=0
  8   0.030203    127.0.0.1 -> 127.0.0.1    TCP 54 0 > cdfunc [RST, ACK] Seq=1 Ack=1 Win=0 Len=0
  9   0.040272    127.0.0.1 -> 127.0.0.1    TCP 54 sdfunc > 0 [<None>] Seq=1 Win=512 Len=0
 10   0.040290    127.0.0.1 -> 127.0.0.1    TCP 54 0 > sdfunc [RST, ACK] Seq=1 Ack=1 Win=0 Len=0
